{
  "schema_version": "1.0",
  "generated_at": "2026-05-11T00:00:00Z",
  "target": {
    "url": "https://hiroooo.github.io/sublog/",
    "captures_dir": "captures",
    "hero_screenshot": "captures/desktop-light.png",
    "label": "Sublog LP — hiroooo.github.io/sublog/"
  },
  "platform": "web",
  "mode": "general",
  "level": "normal",
  "scores": {
    "overall": 77,
    "readability": 85,
    "hierarchy": 75,
    "whitespace": 72,
    "typography": 72,
    "color": 70,
    "image_density": 70,
    "modernity": 70,
    "consistency": 78,
    "accessibility": 80,
    "brand_promise": 88
  },
  "axis_comments": {
    "readability": "Zen Kaku Gothic + 行間 1.7 で本文が読みやすい。行長も適切でストレスなし、コントラストも合格。",
    "hierarchy": "h1 hero が強く視線が固定される。h2 と body の weight 差がやや浅く、中間の階層が弱い場面あり。",
    "whitespace": "縦余白は十分でミニマル路線の呼吸感あり。ただし spacing 17 種 (stdev 11.4px) で 8pt grid 揺れあり。",
    "typography": "Zen Kaku Gothic + SF Pro の組合せが清潔。ただし font-family fallback 7 種で chain が冗長、weight 3 種で階層差控えめ。",
    "color": "黒×白×グレー基調が一貫しミニマル台帳と整合。ただし true black (#000) / true white (#fff) で 2026 標準とは微差あり。",
    "image_density": "hero に大型 visual はないが iPhone モック 4 枚で Brand Promise を視覚化。「できること」6 機能の icon 不在は惜しい。",
    "modernity": "radius 統一 + 過剰 shadow なしでモダン基準合格。ただし subtle gradient / accent / dark mode 不在で 2026 トレンド味は薄い。",
    "consistency": "ミニマル路線がコピー / visual / footer まで貫徹。design token の片鱗 (radius 1 種) もあり、ブランド統一感は良好。",
    "accessibility": "コントラスト◎、ナビ 4 項目で迷いなし。tap target サイズは要実測 (44×44 px が推奨ライン)。",
    "brand_promise": "「スクショ 1 枚で台帳になる」コピー + iPhone モック 4 枚 (「ぜんぶで¥X,XXX」「撮ると一覧」「ホームで台帳」「広告 vs 台帳」) で OCR→台帳の流れが完全視覚化、core feature が立ってる。"
  },
  "issues": [
    {
      "id": "typo_001",
      "axis": "typography",
      "priority": "high",
      "title": "font-family fallback 7 種で chain が冗長",
      "evidence": {
        "screenshot": "captures/desktop-light.png",
        "css_finding": "unique families: Hiragino Kaku Gothic ProN, -apple-system, system-ui, Helvetica Neue, Zen Kaku Gothic New, Noto Sans JP, sans-serif",
        "rule_ref": "rules/20-dasai-typography.md S1"
      },
      "why_dasai": "実際 render される font は 2-3 種だが、fallback chain が長いと FOIT/FOUT のリスク + 何が表示されるか予測困難。design token 不在の兆候。",
      "fix_suggestion": "和文 Zen Kaku Gothic New + 英文 SF Pro/-apple-system + monospace の 3 階層に集約。CSS 変数 (--font-sans / --font-serif / --font-mono) 化",
      "reference_examples": ["https://linear.app", "https://vercel.com"],
      "component_hint": "body, h1, h2 の font-family"
    },
    {
      "id": "space_001",
      "axis": "whitespace",
      "priority": "high",
      "title": "spacing が 17 種、デザイントークン不在",
      "evidence": {
        "screenshot": "captures/desktop-light.png",
        "css_finding": "unique values: 0, 40, 18, 24, 8, 12, 48, 36, 10, 28px ... (stdev 11.4 / 8pt grid 外 多数)",
        "rule_ref": "rules/21-dasai-spacing.md S1"
      },
      "why_dasai": "18, 28, 36px のような 8pt grid 外の値が混じり、余白がランダムに感じられる。ミニマル路線では特に余白の整列度がブランド印象を決める。",
      "fix_suggestion": "4pt / 8pt grid の token (4, 8, 16, 24, 32, 48, 64) に集約。CSS 変数 (--space-1 ~ --space-16) で統一",
      "reference_examples": ["https://stripe.com", "https://linear.app"],
      "component_hint": ".section, .card padding / margin"
    },
    {
      "id": "color_001",
      "axis": "color",
      "priority": "medium",
      "title": "true black (#000) を本文に使用",
      "evidence": {
        "screenshot": "captures/desktop-light.png",
        "crop": [10, 11, 70, 5],
        "highlight": [12, 12, 66, 3],
        "callout": "本文 #000",
        "css_finding": "rgb(0, 0, 0) detected",
        "rule_ref": "rules/23-dasai-color-shadow.md S1"
      },
      "why_dasai": "OLED で滲み / コントラスト過大で長文読了で目が疲れる。2026 は gray-900 (#111-1a) が標準、ミニマル路線でも黒は微トーン落としが現代的。",
      "fix_suggestion": "本文色を #111111 / #1a1a1a に置換。h1 だけ #000 残すのは可",
      "reference_examples": ["https://apple.com/jp/", "https://stripe.com/jp"],
      "component_hint": "body color / h1, h2, p"
    },
    {
      "id": "hero_001",
      "axis": "image_density",
      "priority": "medium",
      "title": "Hero に大型 visual がなく、文字中心で 2026 SaaS LP のインパクト弱め",
      "evidence": {
        "screenshot": "captures/desktop-light.png",
        "crop": [0, 5, 100, 24],
        "highlight": [55, 7, 40, 22],
        "callout": "visual 領域 空白",
        "rule_ref": "rules/22-dasai-imagery.md S2"
      },
      "why_dasai": "Linear / Vercel / Stripe など 2026 SaaS は hero に必ず大型 visual を置く。Sublog は文字 + 小さな App Store ボタンのみで、iPhone モックが scroll 後に出現。Editorial 狙いなら OK だが SaaS としてはコンバージョン弱め。",
      "fix_suggestion": "案 A: iPhone モック 4 枚を hero 内に移動 (above-the-fold で Brand Promise を即体感) / 案 B: hero に animated GIF / Lottie で OCR→台帳の流れを 3 秒ループ",
      "reference_examples": ["https://linear.app", "https://stripe.com"],
      "component_hint": ".hero .visual"
    },
    {
      "id": "imagery_001",
      "axis": "image_density",
      "priority": "medium",
      "title": "「できること」6 機能カードに icon 不在で視覚リズム弱め",
      "evidence": {
        "screenshot": "captures/desktop-light.png",
        "crop": [3, 51, 94, 19],
        "highlight": [5, 53, 90, 15],
        "callout": "6 枚すべて icon なし",
        "rule_ref": "rules/22-dasai-imagery.md S6"
      },
      "why_dasai": "6 つの feature カードが全部テキストのみで、視線が止まる視覚要素がない。スクロール中に「文字の壁」に見える瞬間が生じる。",
      "fix_suggestion": "Lucide / Heroicons (outline) で 6 つ 24px line icon を統一スタイルで配置。色は accent 1 色 (例: #1a73e8 / #5b6cff 等) でリズム作る",
      "reference_examples": ["https://lucide.dev", "https://heroicons.com"],
      "component_hint": ".feature-card 内 svg or i"
    },
    {
      "id": "space_002",
      "axis": "whitespace",
      "priority": "medium",
      "title": "spacing 標準偏差 11.4px (8pt grid 逸脱)",
      "evidence": {
        "screenshot": "captures/desktop-light.png",
        "crop": [3, 16, 94, 20],
        "highlight": [10, 27, 80, 8],
        "callout": "section 間 spacing 揺れ",
        "css_finding": "stdev=11.4 mean=4.6",
        "rule_ref": "rules/21-dasai-spacing.md S1"
      },
      "why_dasai": "section ごとに 18 / 28 / 36px のような半端値が混じり、縦のリズム感が揺らぐ。spacing token を一度敷くと一気に整う。",
      "fix_suggestion": "CSS 変数 :root に --space-2/4/6/8/12/16 を定義、全 padding/margin を変数経由に書き換え",
      "component_hint": "main, section, .card"
    },
    {
      "id": "color_002",
      "axis": "color",
      "priority": "low",
      "title": "true white (#fff) を background に使用",
      "evidence": {
        "css_finding": "rgb(255, 255, 255) detected",
        "rule_ref": "rules/23-dasai-color-shadow.md S1"
      },
      "why_dasai": "long-form では目の疲労、2026 は gray-50 (#fafafa) / off-white が標準。",
      "fix_suggestion": "body background を #fafafa / #f7f7f7 に。card のみ #ffffff で対比を作る",
      "component_hint": "body background-color"
    },
    {
      "id": "modern_001",
      "axis": "modernity",
      "priority": "low",
      "title": "Dark mode 未対応 (prefers-color-scheme 切替なし)",
      "evidence": {
        "screenshot": "captures/desktop-dark.png",
        "crop": [0, 0, 100, 14],
        "callout": "OS が dark でも白背景のまま",
        "css_finding": "html.dark でも body background が rgb(255,255,255) のまま"
      },
      "why_dasai": "2026 標準は最低限 prefers-color-scheme: dark で OS 設定追従。Pro 訴求の「広告なし」と並んで dark-mode 対応はミニマル LP では効きが良い。",
      "fix_suggestion": "@media (prefers-color-scheme: dark) で body bg #0b0b0d, fg #e8e8ee に切替 (CSS 変数化済なら 1 ブロックで完結)",
      "component_hint": "global :root + @media block"
    }
  ],
  "highlights": [
    "「スクショ 1 枚で、サブスクが台帳になる。」 Hero copy が短く強い (15 字以内 + 比喩で具体)",
    "iPhone モック 4 枚で OCR→台帳の流れを完全視覚化 — Brand Promise が hero下で即 visualize",
    "黒×余白ミニマル路線がコピー / visual / footer まで貫徹、ブランド統一感が高い",
    "border-radius が 1 種で統一 (design token の片鱗あり)",
    "プライバシー 3 項目で trust signal を配置 (OCR 端末完結 / カード番号取らない / Apple ID via AdMob)",
    "mobile responsive 完成度が高い (横スクロールなし、左右余白も適切)",
    "ナビゲーション 4 項目で integrity 確保 (プライバシー / 利用規約 / 特商法 / サポート)",
    "footer に法人名 + 全権利留保表記、indie でも legal trust 出ている"
  ],
  "modern_references": [
    {"url": "https://linear.app", "why": "SaaS hero benchmark — 大型 visual + 強 Hook copy + accent CTA"},
    {"url": "https://stripe.com/jp", "why": "info hierarchy + spacing token の手本、和文 LP として参考"},
    {"url": "https://apple.com/jp/", "why": "App Store ボタンの inline embed + 黒系 minimal の現代手本"},
    {"url": "https://vercel.com", "why": "Inter + Geist フォントスタック + subtle gradient hero の参考"}
  ],
  "audit_config": {
    "viewports": ["desktop-1440x900", "tablet-768x1024", "mobile-375x812"],
    "screens": ["LP single page"],
    "focus_axes": ["typography", "whitespace", "image_density", "brand_promise"]
  }
}
